{
  "$schema": "http://json-schema.org/draft-07/schema#",
  "$id": "https://raw.githubusercontent.com/SirDoggyJvla/SteamUploader-rs/refs/heads/main/manifest_schema/mod-manifest-schema.json",
  "title": "Steam Mod Manifest Schema",
  "description": "Schema for mod manifest files used with SteamUploader. Supports JSON, YAML, and TOML formats.",
  "type": "object",
  "required": [
    "appid",
    "content",
    "title"
  ],
  "properties": {
    "$schema": {
      "type": "string",
      "description": "JSON Schema URI that validates this manifest file",
      "examples": ["https://raw.githubusercontent.com/SirDoggyJvla/SteamUploader-rs/refs/heads/main/manifest_schema/mod-manifest-schema.json"]
    },
    "workshopid": {
      "type": "integer",
      "description": "Steam Workshop ID for the mod (if updating an existing item). If not provided, a new item will be created and that field will be added to the mod manifest automatically upon creation.",
      "minimum": 1,
      "examples": [123456789]
    },
    "appid": {
      "type": "integer",
      "description": "Steam application ID for the game",
      "minimum": 1,
      "examples": [108600]
    },
    "content": {
      "type": "string",
      "description": "Path to the mod content directory (relative or absolute)",
      "examples": ["./Contents", "/path/to/mod/content"]
    },
    "preview": {
      "type": "string",
      "description": "Path to the preview image file for the mod (PNG, GIF)",
      "examples": ["./Contents/preview.png", "./animation.gif"]
    },
    "title": {
      "type": "string",
      "description": "Title/name of the mod as it will appear on Steam Workshop",
      "examples": ["SteamUploader test upload JSON", "My Awesome Mod"]
    },
    "description": {
      "type": "string",
      "description": "Path to description file or inline description text. The description of Steam Workshop items uses BBCode formatting.",
      "examples": ["./description.bbcode", "./description.txt", "My mod description"]
    },
    "visibility": {
      "type": "integer",
      "description": "Visibility level for the mod on Steam Workshop. 0=Public, 1=Friends Only, 2=Private/Hidden, 3=Unlisted",
      "enum": [0, 1, 2, 3],
      "default": 2,
      "examples": [0, 1, 2, 3]
    },
    "tags": {
      "type": "array",
      "description": "Tags to categorize the mod. This is dependent on the Workshop of the Game you upload to. Check the game's Workshop page for available tags.",
      "items": {
        "type": "string",
        "minLength": 1
      }
    }
  },
  "additionalProperties": false
}
